{"format":"radarclip-match/1","map":"de_nuke","tickrate":64,"parser":"radarclip 0.1.0","players":[{"key":"p1","name":"Player 1"},{"key":"p2","name":"Player 2"},{"key":"p3","name":"Player 3"},{"key":"p4","name":"Player 4"},{"key":"p5","name":"Player 5"},{"key":"p6","name":"Player 6"},{"key":"p7","name":"Player 7"},{"key":"p8","name":"Player 8"},{"key":"p9","name":"Player 9"},{"key":"p10","name":"Player 10"}],"rounds":[{"number":1,"seconds":33.890625,"winner":"CT","keys":["p7","p2","p10","p5","p3","p9","p4","p6","p1","p8"],"clip":{"format":"radarclip/1","map":"de_nuke","title":"R1","round":1,"winner":"CT","tickrate":64,"start":3,"step":8,"frames":295,"quant":{"xy":4,"z":8,"yaw":2},"focus":[],"marks":[],"places":["CTSpawn","Outside","Garage","LockerRoom","Hell","Heaven","Rafters","HutRoof","BombsiteA","Mini","Admin","Crane","TSpawn","Lobby","Hut","Squeaky"],"weapons":["knife","USP-S","Ursus Knife","Kukri Knife","Incendiary Grenade","Desert Eagle","Glock-18","knife_t","Smoke Grenade","High Explosive Grenade","Flashbang","C4 Explosive"],"players":[{"name":"Player 7","side":"CT","track":{"alive":[0],"k":[0,2,1,8,1,3,9,1,1,1,1,2,1,2,3,1,2,7,4,1,1,1,1,1,1,2,5,3,1,8,18,8,7,1,1,2,1,1,3,1,1,2,5,2,1,5,1,1,1,1,6,4,2,1,1,1,1,1,5,1,1,2,2,1,1,3,1,1,2,2,1,1,1,2,5,2,1,2,1,2,3,3,2,1,1,1,1,2,1,1,2,1,1,1,3,1,1,1,2,2,1,1,1,2,2,2,2,1,1,2,1,1,1,1,1,1,1,1,1,1,1,1,2,1,2,1,2,3,2,1,1,2,1,2,2,2,3,1,1,1,1,1,1,1,2,1,1,3],"x":[638,-2,-6,-60,-8,-20,-56,-7,-7,-8,-9,-12,-2,-3,-5,0,1,7,3,1,0,2,2,4,3,-2,-26,0,1,-5,-4,-9,4,1,1,3,1,4,19,4,-1,-9,-30,-7,-2,-16,-4,-5,-6,-6,-32,-22,-10,-5,-5,-3,2,1,0,-1,0,-1,-1,1,4,15,5,5,0,-10,-7,-6,-5,0,0,-1,0,-2,-3,-10,-21,-7,-2,-2,-1,-5,-6,-15,-9,-8,-17,-8,-8,-8,-13,-1,-1,-2,-10,-11,-1,3,2,-8,-9,3,8,5,6,15,0,0,0,0,0,0,0,0,0,0,0,0,0,0,0,0,0,0,-5,2,3,0,0,-1,-3,-4,12,6,7,7,7,4,4,4,12,5,1,-13],"y":[-106,0,-1,-9,-2,-12,-41,-5,-2,1,0,-11,-9,-17,-25,-7,-15,-55,-31,-8,-7,-8,-7,-6,-7,-12,-21,-18,-1,0,-1,-2,1,3,5,12,7,6,3,4,4,10,22,14,8,35,7,6,5,5,32,23,12,5,7,5,0,0,0,0,1,9,14,6,4,14,6,6,14,9,4,4,3,-2,0,-1,0,-1,1,5,3,-16,-15,-7,-8,-6,-5,-5,1,0,1,1,-2,-2,-16,-7,-7,-7,-12,-10,-5,-4,-5,-3,5,11,13,5,4,0,-3,-3,-1,2,3,1,0,-1,-2,0,0,2,-1,-2,-1,2,2,0,1,0,-1,-2,0,2,7,9,-7,-3,-1,0,-1,-5,-5,-4,-8,-4,-1,7],"z":[-44,0,0,0,0,1,-1,2,3,2,0,-5,0,3,-5,0,0,-8,1,3,2,1,-1,-3,-3,0,0,0,0,0,0,0,0,0,0,0,0,0,0,0,0,0,0,0,0,0,0,0,0,0,0,0,6,2,0,-1,-3,-3,0,3,0,0,-3,-1,0,0,0,0,0,1,4,2,0,7,18,5,2,-2,0,-1,0,0,0,2,3,2,0,-5,-5,-6,3,0,-1,-3,1,4,2,0,-4,-8,0,0,0,-1,0,1,-1,-1,-4,-11,-2,0,0,0,0,5,2,1,0,-4,-3,-1,2,4,2,-1,-7,0,0,0,5,3,-1,-7,0,0,1,3,2,1,-1,-3,-3,0,0,-1,0,1],"yaw":[-86,0,0,1,12,4,-5,2,-12,-6,2,31,13,0,2,0,1,-3,2,-7,20,-28,21,-47,0,2,0,-3,0,0,0,0,0,0,-46,-4,-16,1,1,28,11,4,0,1,-18,3,5,12,-5,-14,8,-2,-4,6,-4,-10,-8,2,-1,0,1,0,-1,-14,-5,1,9,36,3,5,-4,9,0,4,1,4,0,-2,7,3,21,8,-2,2,-5,-13,-6,-12,-6,4,-4,8,21,0,2,9,-1,-7,-7,-9,8,-4,-71,0,-9,-2,-7,7,-16,-16,-15,-2,1,20,-1,-5,-3,5,5,3,16,0,-35,6,6,4,0,-5,0,0,-4,5,4,-6,-13,-2,7,-4,12,3,-11,-33,0,-18,4,10,-17,18],"hp":[0,100],"armor":[0,0],"weapon":[0,0,51,1,109,0,191,1],"place":[0,0,21,1,60,2,121,1,164,3,174,4,187,5,199,6,226,7,240,8]}},{"name":"Player 2","side":"CT","track":{"alive":[0,117],"k":[0,2,2,2,2,2,1,3,2,23,3,2,3,4,3,2,1,8,5,4,2,1,2,2,2,1,2,1,2,2,5,1,2,2,1,1,1,1,1,2,2,2,2,2],"x":[646,-1,-9,0,0,-2,-4,-21,-16,-179,-23,-16,-22,-27,-21,-15,-3,0,-1,-8,-11,-7,-12,-5,-8,-5,-12,-6,-13,-11,-35,-7,-12,-10,-5,-4,-4,-4,-1,-1,-1,-2,8,9],"y":[-126,1,2,0,1,7,3,6,2,-18,-1,-1,-2,3,9,3,0,0,0,3,5,-1,-7,-13,-13,-5,-11,-4,-8,-5,-15,-3,-10,-13,-7,-7,-7,-6,-3,-8,-9,-8,1,9],"z":[-44,0,0,0,0,0,0,0,0,0,7,-2,-13,0,0,5,2,18,13,-1,-1,0,0,0,6,1,-3,-3,-11,0,0,1,6,-1,-3,-4,-5,0,0,0,0,0,0,1],"yaw":[69,0,3,8,0,4,0,0,9,-1,-1,-2,0,-8,-1,8,2,-1,2,5,7,0,4,13,-1,-2,-5,-4,-7,0,1,1,7,6,-1,-8,-13,-19,-5,0,-19,-1,0,-2],"hp":[0,100,105,73],"armor":[0,0],"weapon":[0,1,7,2,103,1],"place":[0,0,27,1,49,4,68,5,79,6,104,7]}},{"name":"Player 10","side":"CT","track":{"alive":[0,169],"k":[0,18,7,3,7,8,1,2,8,4,7,3,3,2,7,4,3,2,5,2,2,2,3,2,4,12,2,2,4,2,5,3,2,2,1,2,1,2,3,1,1,3,2,3,2,2,2],"x":[628,0,-2,-16,-51,-62,-7,-10,-35,1,-18,-12,-16,-11,-42,-28,-17,-5,-7,-3,-9,-13,-21,-9,7,-2,-9,-8,-28,-12,-21,-1,3,9,5,9,-2,-10,-18,-2,3,16,1,12,8,-8,-12],"y":[-126,0,1,6,14,-3,-3,-11,-51,-30,-49,-19,-16,-10,-30,-8,-16,-14,-37,-15,-11,-7,6,5,16,0,-1,-1,1,7,31,22,15,12,5,11,4,0,-11,-1,0,2,-1,-1,0,-2,-1],"z":[-43,0,0,-1,0,0,0,0,0,0,0,-2,-1,-5,0,0,0,0,0,0,0,0,0,0,0,0,0,0,0,0,0,0,0,0,0,0,0,0,0,0,0,0,0,0,0,0,0],"yaw":[72,2,5,1,10,2,0,21,4,0,3,-8,-4,-1,3,4,-1,-2,-26,-5,-2,-3,-2,0,1,5,-2,-9,-3,-3,2,3,-23,-2,2,13,10,-1,-17,1,-1,-5,-8,15,4,-7,-3],"hp":[0,100,158,73,166,71],"armor":[0,0],"weapon":[0,1,27,3,28,1,34,3,51,4,63,1,69,4,109,1],"place":[0,0,42,1,128,9,138,8]}},{"name":"Player 5","side":"CT","track":{"alive":[0],"k":[0,1,2,22,3,1,6,1,2,2,3,2,1,1,1,1,1,1,5,4,3,2,17,1,3,1,3,3,2,4,8,1,2,1,1,6,1,1,1,1,1,1,1,1,4,1,1,1,1,2,1,1,1,2,3,3,1,1,3,4,1,1,1,1,2,3,4,13,1,1,3,1,2,1,2,7,5,4,2,2,2,2,1,1,1,1,1,2,2,1,1,1,1,2,3,1,1,1,1,2,3,1,1,1,1,1,2,1,3,1,1,1,2,2,2,1,2,1,1,2,1,1,1,2,1,2,1,2,1,1,1,1,2,3,3],"x":[626,-4,-12,-171,-21,-7,-45,-7,-7,-11,-20,-10,-6,-7,-7,-4,-1,2,2,2,0,0,0,0,0,0,0,1,0,0,0,0,-3,-3,-2,-3,1,3,6,3,-3,-5,0,0,0,0,-1,-1,-1,-3,-1,-2,-3,-7,-11,-8,2,2,-13,-3,-1,1,4,3,-2,0,0,-1,0,0,7,0,-1,-2,0,-1,0,0,4,0,-1,-7,-5,-7,-6,1,1,3,3,2,1,0,-1,3,-2,-3,-6,-7,-5,-11,-13,-6,-6,1,1,-1,-10,-6,-13,-6,0,3,10,7,-2,-4,-9,-5,-5,-11,-3,-1,2,8,6,12,4,6,4,2,-1,-1,-7,-14,-4],"y":[-86,0,-2,-16,-3,-1,-4,-1,-3,3,12,12,5,2,4,7,4,6,35,29,4,-7,2,1,17,0,-5,-17,5,3,0,-4,-12,-6,-8,-47,-7,-8,-6,-7,-7,-4,1,0,1,0,0,0,0,-1,0,-2,-1,7,5,-5,-4,0,6,2,0,-1,-3,-4,-9,-4,-23,-2,0,-1,-11,-2,-9,-6,-9,-13,2,19,10,6,-1,-9,-4,2,3,6,5,10,11,5,3,1,-2,-8,-22,-8,-5,-4,-6,-10,-9,-4,-5,-6,-7,-7,-10,-3,-7,-2,-4,-3,-6,-12,-13,-6,-11,-5,-1,0,-1,0,-3,-8,-3,-4,-4,-6,-3,-5,-1,0,-8,-17,-19],"z":[-44,0,0,0,8,-1,-12,-3,0,0,1,5,1,-1,-3,-3,0,0,0,0,0,0,0,0,0,0,0,0,0,0,0,0,0,0,0,0,3,2,2,0,-2,-1,4,4,19,5,4,3,1,-3,-3,-1,-1,0,0,0,0,0,0,0,0,0,0,0,0,0,0,0,0,0,0,0,0,0,0,0,0,0,0,0,0,1,4,2,0,-1,-3,-10,-16,-11,-2,0,0,0,0,4,2,1,-1,-4,0,0,3,3,1,0,-6,-3,0,0,0,0,0,0,6,1,-3,-4,0,0,0,0,0,0,0,0,0,0,0,0,0,0,0,0,0],"yaw":[-87,0,-1,2,-2,0,-1,-4,-12,0,0,-11,12,6,-12,-3,8,15,-3,4,-1,-1,0,2,0,1,-1,-2,0,1,1,30,-1,11,3,1,2,12,4,-15,-25,-16,4,11,6,-1,-8,-8,0,-11,0,7,2,3,-2,2,23,-3,4,7,-1,-18,1,6,0,-3,-4,0,-8,1,-6,0,-1,10,3,-3,3,2,1,1,-1,-2,-15,-27,-19,-9,-2,0,1,0,-2,22,66,2,-2,-10,-10,1,5,-8,0,1,17,11,-1,-8,-19,-3,-5,4,30,14,-2,1,-23,-4,-1,-8,-13,2,37,22,0,5,21,1,5,21,-27,-65,-5,0,0,0,0],"hp":[0,100,228,63],"armor":[0,0],"weapon":[0,0,49,5,108,0,131,5,214,0,258,5,286,0],"place":[0,0,16,1,40,4,51,10,119,4,131,5,146,6,148,5,151,6,194,11,208,6,226,8,293,9]}},{"name":"Player 3","side":"CT","track":{"alive":[0],"k":[0,8,1,1,5,12,6,8,1,3,1,2,2,3,3,2,5,2,1,1,1,2,3,1,2,2,2,7,1,1,2,1,2,3,1,2,1,2,1,2,2,1,1,2,1,2,2,3,4,1,1,1,1,2,2,2,1,1,1,1,2,2,1,3,1,3,1,2,1,2,3,1,2,2,3,2,2,1,2,1,2,5,4,2,1,2,75,7,1,1,2,3,1,2,1,2,2,1,1,1,1,1,1],"x":[646,0,-1,-5,-36,-93,-41,-59,-7,-22,-7,-15,-2,0,-6,-13,-38,-15,-8,-4,1,2,0,1,8,8,-6,-1,0,0,-2,-1,-8,-21,-7,-7,-2,-7,-6,-13,-13,-5,-5,-5,-2,-4,-3,-2,1,0,0,-2,-4,-11,-11,-8,-7,-5,-2,-1,-3,-6,-2,-7,0,0,0,6,1,-5,-14,-4,0,5,6,0,-1,0,9,7,11,1,3,4,4,9,0,0,1,3,13,22,8,12,5,6,-1,-3,-2,-3,-6,-7,-6],"y":[-86,0,-1,-1,-8,-9,-5,-16,-1,-8,-3,-4,0,3,15,2,-7,1,1,4,5,5,-3,-3,-3,7,6,-5,3,3,-1,0,1,4,-2,-10,-7,-12,-5,-8,-9,-2,1,10,3,-1,1,-4,4,1,0,3,4,8,7,0,-2,-2,-3,-3,-7,2,1,-4,0,3,-4,-10,-5,-12,-18,-6,0,6,4,0,-7,0,3,1,1,0,-22,-11,1,4,0,0,0,2,1,4,4,10,5,12,14,7,7,5,3,-1,-1],"z":[-44,0,0,0,0,0,0,0,0,-8,0,5,2,-7,0,0,0,0,0,0,0,0,0,0,0,0,6,24,3,3,2,-1,-1,0,0,0,2,5,0,-5,-11,-1,0,0,-2,-8,-14,0,0,0,0,0,-2,0,0,0,0,1,0,0,0,-1,0,0,0,0,0,0,0,0,7,0,-4,-1,-1,0,2,0,-1,-2,2,0,0,0,0,-1,0,0,0,-1,0,7,0,-5,1,5,-1,-3,-2,3,2,1,-1],"yaw":[-65,2,-23,2,1,0,0,0,0,0,0,0,0,0,0,0,1,-6,-18,-31,-6,-33,1,9,26,32,13,-4,2,14,5,1,1,12,3,4,5,-12,-5,-4,-4,-9,-5,4,-5,2,2,-5,-3,5,19,5,3,8,-24,-2,10,3,47,13,8,4,-5,5,-6,-4,-23,-2,-12,0,27,-1,-1,-4,-9,28,2,-36,-3,-2,-1,-2,-1,52,11,4,2,-1,-4,-17,0,6,5,12,-7,19,17,8,-9,14,22,11,-1],"hp":[0,100,136,73,141,45],"armor":[0,0],"weapon":[0,1,12,0,95,1,99,0,105,1,135,6,274,0,292,6],"place":[0,0,28,1,58,4,88,5,98,6,116,8]}},{"name":"Player 9","side":"T","track":{"alive":[0,143],"k":[0,4,7,17,3,2,3,3,3,2,4,7,2,1,3,2,2,1,2,3,2,5,2,3,2,2,4,2,1,1,1,1,2,3,2,2,1,2,1,2,2,1,2,2,1,2,3,2,2,2,2,5,2,2],"x":[-487,14,48,129,22,10,19,15,15,10,27,33,11,8,21,3,1,2,6,18,15,33,13,21,15,13,11,5,5,7,7,7,12,10,-1,-1,3,5,1,6,11,7,13,14,6,15,22,13,9,1,-8,-34,-14,-15],"y":[-242,-17,-23,-3,0,4,2,15,8,9,11,42,10,1,-6,-13,-15,-7,-15,-13,0,13,7,5,-1,-6,-18,-13,-6,-3,0,0,7,19,15,15,6,14,4,-4,0,0,-1,4,-1,-1,3,6,12,13,10,15,3,1],"z":[-52,0,0,0,0,0,0,0,0,0,0,1,-1,0,0,0,0,0,0,0,0,0,0,0,0,0,0,0,0,1,2,0,0,0,0,0,0,0,0,0,0,-1,0,-2,0,2,0,0,0,-1,1,0,-2,0],"yaw":[-12,1,10,6,14,0,-1,2,1,0,1,-7,-9,-9,-23,-9,0,2,14,19,1,-1,-7,-10,-3,0,7,19,15,5,0,3,3,0,-4,-26,-4,5,-1,1,5,-2,-23,22,-2,14,18,11,13,18,2,6,4,10],"hp":[0,100],"armor":[0,100],"weapon":[0,7,70,6],"place":[0,12,40,1,63,13,96,14,115,8]}},{"name":"Player 4","side":"T","track":{"alive":[0,145],"k":[0,3,1,6,1,17,5,2,6,3,4,2,2,1,2,1,2,2,3,1,2,3,6,1,3,3,3,1,4,1,5,1,1,4,2,1,1,1,1,3,2,1,3,2,3,3,1,3,1,2,1,2,1,3,1,1,3],"x":[-470,1,4,35,7,129,39,14,39,18,13,9,14,7,15,8,13,5,1,0,6,19,44,6,6,8,13,6,25,7,36,7,7,27,15,7,8,7,7,18,11,4,2,8,15,12,3,2,0,3,0,-6,-6,-6,0,0,2],"y":[-245,0,-3,-23,-3,-2,3,4,25,13,28,11,7,3,2,-1,-4,-13,-23,-7,-13,-9,-12,-3,-19,-21,-18,-1,13,0,-13,0,2,13,0,-1,0,1,3,14,10,6,19,11,17,18,7,22,8,14,7,13,4,14,3,-2,-14],"z":[-52,0,0,0,0,0,0,0,0,0,0,0,0,0,0,0,0,0,0,0,0,0,0,0,0,0,0,0,0,0,0,0,0,0,0,0,0,0,0,0,0,0,0,0,1,-1,0,0,0,0,0,0,0,0,0,0,0],"yaw":[-16,0,-1,2,9,8,4,12,0,-4,-6,4,-2,-11,-1,-7,-15,-1,4,6,6,3,-1,-4,-2,7,7,0,-11,-1,-1,0,19,4,11,0,4,18,0,-4,11,-2,-5,-1,11,1,12,0,-12,0,17,0,14,5,0,2,-1],"hp":[0,100],"armor":[0,0],"weapon":[0,6,9,8,64,6,81,8,100,6],"place":[0,12,38,1,61,13,82,15,97,8]}},{"name":"Player 6","side":"T","track":{"alive":[0,122],"k":[0,3,7,3,13,3,3,3,5,3,2,2,2,2,3,3,3,3,2,3,6,4,2,3,3,2,4,6,1,2,1,1,1,2,2,3,1,2,6,1],"x":[-458,16,53,23,96